{
  "$schema": "https://json-schema.org/draft/2020-12/schema",
  "$id": "urn:emsenn:corpus-management-team:schema:unfulfilled-capability-dependency",
  "type": "object",
  "required": ["id", "kind", "consumer", "intended-provider", "intended-contract", "capability", "formal-basis", "state", "reason", "forbidden-substitutes"],
  "additionalProperties": false,
  "properties": {
    "id": {"const": "obsmetrologia-enterprise-observation-coordination-measurement"},
    "kind": {"const": "unfulfilled-capability-dependency"},
    "consumer": {"const": "corpus-management-team"},
    "intended-provider": {"const": "obsmetrologia"},
    "intended-contract": {"const": "deriving-an-enterprise-cover-nerve-rank-leg"},
    "capability": {"type": "string", "minLength": 1},
    "formal-basis": {"type": "object", "required": ["carrier", "declarations"], "additionalProperties": false, "properties": {"carrier": {"const": "scripts/EnterpriseObservationContractRevision4DesignScratch.lean"}, "declarations": {"type": "array", "minItems": 5, "uniqueItems": true, "items": {"type": "string", "minLength": 1}}}},
    "state": {"const": "unfulfilled"},
    "reason": {"type": "string", "minLength": 1},
    "forbidden-substitutes": {"type": "array", "minItems": 1, "uniqueItems": true, "items": {"type": "string", "minLength": 1}}
  }
}
